{
  "expires_at": "2026-09-15T00:00:00.000Z",
  "issued_at": "2026-08-16T00:00:00.000Z",
  "items": [],
  "pack_format_version": 1,
  "pack_salt": "a1b2c3d4e5f60718293a4b5c6d7e8f90",
  "puzzles": [
    {
      "kind": "kenken",
      "payload": {
        "board": {
          "blocked": [],
          "given": [],
          "size": 3,
          "solution": [
            [
              1,
              2,
              3
            ],
            [
              2,
              3,
              1
            ],
            [
              3,
              1,
              2
            ]
          ]
        },
        "cages": [
          {
            "cells": [
              {
                "col": 0,
                "row": 0
              },
              {
                "col": 0,
                "row": 1
              }
            ],
            "operation": "+",
            "target": 3
          },
          {
            "cells": [
              {
                "col": 1,
                "row": 0
              },
              {
                "col": 2,
                "row": 0
              }
            ],
            "operation": "-",
            "target": 1
          },
          {
            "cells": [
              {
                "col": 1,
                "row": 1
              },
              {
                "col": 1,
                "row": 2
              }
            ],
            "operation": "-",
            "target": 2
          },
          {
            "cells": [
              {
                "col": 2,
                "row": 1
              },
              {
                "col": 2,
                "row": 2
              }
            ],
            "operation": "+",
            "target": 3
          },
          {
            "cells": [
              {
                "col": 0,
                "row": 2
              }
            ],
            "operation": "+",
            "target": 3
          }
        ]
      },
      "reference_sheet": [
        "Una jaula de dos celdas con − pide la diferencia.",
        "Ningún número se repite en su fila ni en su columna."
      ],
      "tutorial_steps": [
        "Cada fila y cada columna llevan 1, 2 y 3 una sola vez.",
        "La esquina de cada jaula dice el resultado y la operación."
      ]
    }
  ],
  "skill_fallbacks": [],
  "skill_nodes": []
}
