{
  "expires_at": "2026-09-15T00:00:00.000Z",
  "issued_at": "2026-08-16T00:00:00.000Z",
  "items": [
    {
      "answer": {
        "digest": "260f4be848f57a51b9cf9ec27b4d718795f15798d012f22a5f3267a8e3d6b130",
        "shape": "integer"
      },
      "diagnosis": null,
      "keypad": "item",
      "ladder_step": 6,
      "skill_id": 5,
      "stimulus": {
        "kind": "hiddenOperation",
        "payload": {
          "examples": [
            {
              "input": 2,
              "output": 7
            },
            {
              "input": 5,
              "output": 16
            }
          ],
          "query_input": 9
        }
      }
    }
  ],
  "pack_format_version": 1,
  "pack_salt": "a1b2c3d4e5f60718293a4b5c6d7e8f90",
  "puzzles": [],
  "skill_fallbacks": [
    {
      "diagnosis": {
        "explain": "Aquí va el razonamiento completo, paso por paso, sin regaños.",
        "misconception": "unclassified",
        "steps": [
          "Vuelve a ver el paso de en medio.",
          "Ahí es donde se decide el resultado."
        ]
      },
      "skill_id": 5
    }
  ],
  "skill_nodes": [
    {
      "skill_id": 5,
      "state": "started"
    }
  ]
}
