{
  "expires_at": "2026-09-15T00:00:00.000Z",
  "issued_at": "2026-08-16T00:00:00.000Z",
  "items": [],
  "pack_format_version": 1,
  "pack_salt": "a1b2c3d4e5f60718293a4b5c6d7e8f90",
  "puzzles": [
    {
      "kind": "wordSearch",
      "payload": {
        "grid": [
          [
            "S",
            "U",
            "M",
            "A",
            "X"
          ],
          [
            "C",
            "Y",
            "Z",
            "W",
            "B"
          ],
          [
            "E",
            "D",
            "F",
            "G",
            "H"
          ],
          [
            "R",
            "I",
            "J",
            "K",
            "L"
          ],
          [
            "O",
            "N",
            "P",
            "Q",
            "T"
          ]
        ],
        "words": [
          "SUMA",
          "CERO"
        ]
      },
      "reference_sheet": [
        "Una palabra aparece una sola vez en la sopa."
      ],
      "tutorial_steps": [
        "Busca cada palabra de la lista.",
        "Puede ir en cualquier dirección, siempre derecha."
      ]
    }
  ],
  "skill_fallbacks": [],
  "skill_nodes": []
}
