{
  "expires_at": "2026-09-15T00:00:00.000Z",
  "issued_at": "2026-08-16T00:00:00.000Z",
  "items": [
    {
      "answer": {
        "digest": "fbd67243a5921d623d627768046486f8340ca38129a6efc09d19263422c90e9f",
        "shape": "integer"
      },
      "diagnosis": null,
      "keypad": "item",
      "ladder_step": 3,
      "skill_id": 2,
      "stimulus": {
        "kind": "numberSeries",
        "payload": {
          "terms": [
            2,
            4,
            8,
            16,
            32
          ],
          "unknown_index": 4
        }
      }
    }
  ],
  "pack_format_version": 1,
  "pack_salt": "a1b2c3d4e5f60718293a4b5c6d7e8f90",
  "puzzles": [],
  "skill_fallbacks": [
    {
      "diagnosis": {
        "explain": "Aquí va el razonamiento completo, paso por paso, sin regaños.",
        "misconception": "unclassified",
        "steps": [
          "Vuelve a ver el paso de en medio.",
          "Ahí es donde se decide el resultado."
        ]
      },
      "skill_id": 2
    }
  ],
  "skill_nodes": [
    {
      "skill_id": 2,
      "state": "available"
    }
  ]
}
